homograph	wordid	sentence	start	end	orig_idx
reading	reading_en	"To get a few of my favorite lines, just keep reading."""	45.0	52.0	9005.0
reading	reading_en	The tests focus on the state's Academic Standards for reading, writing, mathematics and science.	54.0	61.0	8945.0
reading	reading_en	The reading specialist is authorized to teach reading and to provide technical assistance and professional development to teachers.	46.0	53.0	9024.0
reading	reading_en	He adapted to reading music and developed a good ear and natural musical intelligence.	14.0	21.0	9010.0
reading	reading_en	If I m really interested in what I m reading I mean hours can go by			
reading	reading_en	"Signs were put up around South Armagh reading ""Sniper at Work""."	38.0	45.0	8982.0
reading	reading_en	Yamaguchi quickly wrote the song after reading a review in Musica of Clammbon's album Musical (2007).	39.0	46.0	8990.0
reading	reading_en	Widya hobbys are singing, reading, and browsing the internet.	26.0	33.0	12444.0
reading	reading_en	The Poly-88 ROM contained a boot loader program, capable of reading programs from the cassette tape interface.	60.0	67.0	8993.0
reading	reading_en	He likes reading horror stories, especially vampire stories like those written by Sheridan Le Fanu or Hugh Walpole.	9.0	16.0	12441.0
reading	reading_geo	Keeping of weather records was originally started by the University College of Reading (a precursor of the university) in 1900.	79.0	86.0	8979.0
reading	reading_en	Its genome has been sequenced and contains approximately 6600 nucleotides organized into four open reading frames.	99.0	106.0	9021.0
reading	reading_en	These are not digraphs, as they retain the normal sequential reading of the two glyphs.	61.0	68.0	8978.0
reading	reading_en	His performance is based on Charles Dickens' original reading tour script.	54.0	61.0	9002.0
reading	reading_en	In this respect, bulk reading is a fuzzy method for process support.	22.0	29.0	9019.0
reading	reading_en	Interestingly some of the information I  been reading indicates that the amount of air pollution from uh uh airplanes is extraordinary			
reading	reading_geo	Spiller replaces Councilwoman Michele Charmello, who represented the Third Ward sections of Avenel and Port Reading.	108.0	115.0	8999.0
reading	reading_en	And I think that that s why reading is so important			
reading	reading_en	After a bill takes its second reading, it is open to debate on amendments and motions.	30.0	37.0	8996.0
reading	reading_geo	The signal covers South Central Pennsylvania and can be heard in neighboring communities such as York, Harrisburg, Reading and Lebanon.	115.0	122.0	8952.0
reading	reading_geo	The station is licensed to Boyertown, Pennsylvania and serves the Reading area.	66.0	73.0	9008.0
reading	reading_en	In 2013-14, only 58% of the students were reading on grade level in grades 3rd through 5th.	42.0	49.0	8968.0
reading	reading_en	The College Board also reported that nationwide scores were: 497 in reading, 513 in math and 487 in writing.	68.0	75.0	8950.0
reading	reading_en	But it s nice light reading			
reading	reading_en	Much emphasis is given to the importance of reading and to reflecting on the reading.	77.0	84.0	8991.0
reading	reading_en	The author tells his dramatic story authoritatively, but with a light hand which makes for entertaining reading.	104.0	111.0	9030.0
reading	reading_en	In reading, just 77% of the students were on grade level.	3.0	10.0	8949.0
reading	reading_en	Patrick Nye joined the Laboratories to lead a team working on the reading machine for the blind.	66.0	73.0	9003.0
reading	reading_en	Trainees were taught theoretical and practical subjects including physical training, shooting, explosives, sabotage, map-reading, Morse code, and observation skills.	121.0	128.0	8965.0
reading	reading_geo	In late 870, King Ethelred led the army of Wessex against the Danes in their stronghold at Reading.	91.0	98.0	9026.0
reading	reading_geo	Sandhurst Station has two platforms: Platform 1 for services towards Gatwick Airport and Platform 2 for services towards Reading.	121.0	128.0	12437.0
reading	reading_en	Buchan's three novels were written to interest his students in reading.	63.0	70.0	8944.0
reading	reading_geo	He signed for Reading at the age of 15.	14.0	21.0	8989.0
reading	reading_en	Certain statistics such as combat skill and endurance attributes are determined randomly before play (reading).	102.0	109.0	9011.0
reading	reading_en	I just think uh you know it s it s light reading			
reading	reading_geo	The Philadelphia and Reading, sometimes referred to as the Reading Railroad, merged the short line as its Perkiomen Branch.	21.0	28.0	9032.0
reading	reading_en	Um I do n't do as much reading like I say as I would like to			
reading	reading_en	For the purposes of this example, this array supports both reading and writing elements.	59.0	66.0	9029.0
reading	reading_en	Norwegian Institute for Adult Learning, or VOX-laering for arbeidslivet (official site) Promotes adult learning within reading, writing, arithmetic and ICT.	119.0	126.0	8954.0
reading	reading_en	Taylor learned that he was to receive the award in mid-December after reading several newspapers.	70.0	77.0	9023.0
reading	reading_geo	He was an Assistant Master at Harrow School and Perpetual curate at Holy Trinity, Reading until his appointment as Archdeacon.	82.0	89.0	8946.0
reading	reading_en	The tests focused on the state's Academic Standards for reading, writing, mathematics and science.	56.0	63.0	8948.0
reading	reading_en	But but it is good reading			
reading	reading_en	Inner-ear-enhancing anti-motion sickness medications were clinically recognized to improve most all reading and non-reading dyslexic symptoms and mechanisms.	100.0	107.0	8959.0
reading	reading_en	And I read the whole damn book while I was home hauling out you know like ten  buckets of of water and waiting for the roof to collapse and reading about these guys wearing their little free man still suits			
reading	reading_en	Therefore my my reading pleasures are quite wide			
reading	reading_geo	He obtained a BSc degree from Reading University.	30.0	37.0	8992.0
reading	reading_en	Starfall is a children's website that teaches basic English reading and writing skills.	60.0	67.0	9016.0
reading	reading_en	The fifth grade is evaluated in reading, mathematics and writing.	32.0	39.0	8957.0
reading	reading_en	This can be done directly at the request of opening a CI, but also after some time of reading it.	86.0	93.0	8964.0
reading	reading_en	But I never seem to have the time to do that kind of reading			
reading	reading_en	The concept of the triple goddess has been applied to a feminist reading of Shakespeare.	65.0	72.0	8972.0
reading	reading_en	The degree of overloading was consistent with ground crew reading the kilogram markings on the cargo as pounds.	58.0	65.0	9028.0
reading	reading_en	So I enjoy reading parts on travel in the various you know different ones			
reading	reading_en	His two early books remained unnoticed by the reading public.	46.0	53.0	8947.0
reading	reading_en	Well I was just reading an article in uh a north carolina  paper today where a high school student obtained over two hundred thousand dollars worth of scholarships for herself by sitting up at night and typing at uh letters of applications to universities			
reading	reading_geo	Further defeats to Team Northumbria and Reading sealed their exit at the conclusion of the group stage.	40.0	47.0	8963.0
reading	reading_en	The testing of 8th grade in reading and mathematics began in 1999, as a state initiative.	28.0	35.0	9007.0
reading	reading_en	She taught women hygiene, discipline, health, reading and writing.	46.0	53.0	8958.0
reading	reading_en	It it s very a typical for my reading though			
reading	reading_en	During his pontificate, Pope John XXIII recommended the reading of Duns Scotus's theology to modern theology students.	56.0	63.0	8994.0
reading	reading_en	It may also be obtained through interviews, downloads from online sources, or reading documentation.	78.0	85.0	9001.0
reading	reading_en	The reading featured Russell Tovey, Gina McKee, Simon Paisley Day and Flora Spencer-Longhurst.	4.0	11.0	8951.0
reading	reading_geo	The Scranton/Wilkes-Barre RailRiders were founded in 1919 in Reading, Pennsylvania, as the Reading Coal Barons.	91.0	98.0	9000.0
reading	reading_en	It is arranged in the traditional way, beginning top right and reading columns down.	63.0	70.0	8987.0
reading	reading_en	The reading room was turned over to the Women's Christian Temperance Union (WCTU) in 1888.	4.0	11.0	8995.0
reading	reading_geo	Following graduation, he began his professional career with the Reading Rage of the Premier Development League.	64.0	71.0	9009.0
reading	reading_en	And all I do is teach reading all day long			
reading	reading_en	Conversely, a higher reading (~1.02) of the ratio indicates a bearish sentiment in the market.	21.0	28.0	12438.0
reading	reading_en	The percentage of high school students who scored proficient and advanced in reading/literature declined to 52.5%.	77.0	84.0	8983.0
reading	reading_en	"Sadly, his decline makes for reading more painful than engrossing."""	29.0	36.0	8967.0
reading	reading_en	But if you are going to read ten, reading Lomborg may be worthwhile.	34.0	41.0	12442.0
reading	reading_en	This largely accounts for the focus on time spent reading, especially independent reading.	82.0	89.0	9004.0
reading	reading_en	Uh what kind of books do you enjoy reading			
reading	reading_en	I was reading just recently where the typical administrator in the montgomery county public schools makes			
reading	reading_en	In 2012, Grandview Elementary School declined to Warning AYP status, due to lagging achievement in reading and math.	99.0	106.0	8962.0
reading	reading_en	The children and Mark often speculate over what tale he is from, sometimes reading through a book of nursery rhymes.	75.0	82.0	8977.0
reading	reading_en	Dismissing the theory as based on a faulty reading of the original text.	43.0	50.0	8973.0
reading	reading_en	This remains, however a fast and easy way to gain a little further depth in a reading.	78.0	85.0	9014.0
reading	reading_en	I was reading			
reading	reading_en	So I do n't know why what that was reading it for			
reading	reading_en	I d say first of all they need to go back to spending more time on the basic reading writing arithmetic in grade school			
reading	reading_en	He did much of his studying by reading manuscripts he found while working as a librarian.	31.0	38.0	8981.0
reading	reading_en	Reading and replying to the mail sometimes takes her more than eight hours a day.	0.0	7.0	8971.0
reading	reading_en	I I was reading the other day about uh corpus christi Texas which has the the highest			
reading	reading_en	The national averages were 505 for mathematics, 491 for reading, and 494 for writing.	56.0	63.0	9017.0
reading	reading_en	The English Common Reader: A Social History of the Mass Reading Public, 1800-1900.	56.0	63.0	12443.0
reading	reading_en	That s good fun reading			
reading	reading_en	Text linguistics stimulates reading by arousing interest in texts or novels.	28.0	35.0	9006.0
reading	reading_en	The College Board reported that nationwide scores were: 497 in reading, 513 in math and 487 in writing.	63.0	70.0	8998.0
reading	reading_geo	Franklin Gowen endeavored to improve upon the benefits to the Reading Railroad of this shipping terminus / transshipping hub.	62.0	69.0	9027.0
reading	reading_en	He enjoys reading, cycling and playing golf.	10.0	17.0	8986.0
reading	reading_en	Another possibility was that the reading of the three-pointer altimeter was misinterpreted.	33.0	40.0	9012.0
reading	reading_en	Reading it she finally realizes her father's true intentions and returns home to her family.	0.0	7.0	8984.0
reading	reading_en	His interests include rugby, reading and music.	29.0	36.0	12439.0
reading	reading_en	Instructions were given on a wide variety of items ranging from first aid, map reading, chemical warfare, and demolitions.	79.0	86.0	8956.0
reading	reading_en	"Dan is reading a Gossip Girl post about how his book, ""Inside"" is failing."	7.0	14.0	9015.0
reading	reading_en	I was reading something in uh consumer reports tonight about that as a matter of fact			
reading	reading_en	"The Tyler supporters, holding signs reading ""Tyler and Texas!"""	36.0	43.0	8980.0
reading	reading_en	Reading Leviticus 8:23, Milgrom noted that abundant attestation exists of ritual daubing in the ancient Near East.	0.0	7.0	8974.0
reading	reading_en	It combines a reading of Hegel's philosophical works and of Jean Genet's autobiographical writing.	14.0	21.0	9013.0
reading	reading_en	The book has become required reading for secondary schoolchildren in Thailand.	29.0	36.0	9018.0
reading	reading_en	That is an intriguing type of book to be reading and trying to keep up on things like that			
reading	reading_en	Just joy reading			
